number,value,datetime_start,datetime_complete,duration,params_dropout_p,params_hidden_weights0,params_hidden_weights1,params_initializers,params_kernel1,params_kernel2,params_learning_rate,params_momentum,params_n_fc_layers,params_optimizer,params_weight_decays,state
421,0.8548295497894287,2024-04-22 11:14:46.919918,2024-04-22 11:15:02.352225,0 days 00:00:15.432307,0.17607736581941605,559.0,,True,4,3,0.00018138569901346844,,2,Adam,0.0011872484186147248,COMPLETE
422,0.9705095589160919,2024-04-22 11:15:02.352553,2024-04-22 11:15:17.808018,0 days 00:00:15.455465,0.16074431764766917,524.0,,True,4,3,0.0002323860675144204,,2,Adam,0.0002726695025515518,COMPLETE
423,0.9174883365631104,2024-04-22 11:15:17.808322,2024-04-22 11:15:33.232933,0 days 00:00:15.424611,0.18219381088433365,496.0,,True,4,3,0.00019778813919015784,,2,Adam,0.0007259608289232321,COMPLETE
424,0.837295264005661,2024-04-22 11:15:33.233259,2024-04-22 11:15:48.658231,0 days 00:00:15.424972,0.17235902470728576,563.0,,True,4,3,0.00016191887779774206,,2,Adam,0.0004452979872444301,COMPLETE
425,0.9789389669895172,2024-04-22 11:15:48.658579,2024-04-22 11:16:04.151968,0 days 00:00:15.493389,0.1542652158347083,595.0,,True,4,3,0.00024415132500174856,,2,Adam,0.0009225727694396299,COMPLETE
426,0.7451132535934448,2024-04-22 11:16:04.152308,2024-04-22 11:16:19.633251,0 days 00:00:15.480943,0.19444531707262672,534.0,,True,4,3,0.00021303600555594597,,2,Adam,0.0005447983501061556,COMPLETE
427,1.023472547531128,2024-04-22 11:16:19.633574,2024-04-22 11:16:35.044128,0 days 00:00:15.410554,0.2071033397409758,543.0,,False,4,3,0.00027505116347807413,,2,Adam,0.0004015221386647364,COMPLETE
428,0.8586228787899017,2024-04-22 11:16:35.044447,2024-04-22 11:16:50.511413,0 days 00:00:15.466966,0.1940103724530726,579.0,281.0,True,4,3,0.0002241739399169107,,3,Adam,0.00045855648275890793,COMPLETE
429,1.013608455657959,2024-04-22 11:16:50.511736,2024-04-22 11:17:05.948307,0 days 00:00:15.436571,0.21687464854377672,559.0,,True,4,3,0.0001428360732339028,,2,Adam,0.0005991806774560138,COMPLETE
430,0.8149731159210205,2024-04-22 11:17:05.948641,2024-04-22 11:17:21.313834,0 days 00:00:15.365193,0.16515981122124124,486.0,,True,4,3,0.00021674694452678418,,2,Adam,0.0005286978886295073,COMPLETE
431,1.1000290513038635,2024-04-22 11:17:21.314169,2024-04-22 11:17:36.766617,0 days 00:00:15.452448,0.19845683560768315,529.0,,True,4,3,0.00026125911684301195,,2,Adam,0.0015010594853776013,COMPLETE
432,0.8773398399353027,2024-04-22 11:17:36.766940,2024-04-22 11:17:52.248297,0 days 00:00:15.481357,0.21686172986000377,506.0,,True,4,3,0.00015966827869492395,,2,Adam,0.0005011290949770486,COMPLETE
433,0.8241188824176788,2024-04-22 11:17:52.248629,2024-04-22 11:18:07.757561,0 days 00:00:15.508932,0.16853141091858584,545.0,257.0,True,4,3,0.0001959749350761221,,3,Adam,0.00041511108649246636,COMPLETE
434,0.7573108375072479,2024-04-22 11:18:07.757903,2024-04-22 11:18:23.165165,0 days 00:00:15.407262,0.15539861140265568,477.0,272.0,True,4,3,0.0002890445315979093,,3,Adam,0.000543547799669144,COMPLETE
435,1.0106752812862396,2024-04-22 11:18:23.165486,2024-04-22 11:18:38.639380,0 days 00:00:15.473894,0.15448517907288722,484.0,262.0,True,4,3,0.0003152095088291254,,3,Adam,0.0003405984940869483,COMPLETE
436,1.0595641732215881,2024-04-22 11:18:38.639703,2024-04-22 11:18:54.048311,0 days 00:00:15.408608,0.1600137998918572,470.0,268.0,True,4,3,0.00017238536302058592,,3,Adam,0.0005171707341530016,COMPLETE
437,0.8925609886646271,2024-04-22 11:18:54.048616,2024-04-22 11:19:09.631092,0 days 00:00:15.582476,0.17037858250608395,497.0,250.0,True,4,5,0.0003421222905421492,,3,Adam,0.0005992846479607528,COMPLETE
438,0.7382326126098633,2024-04-22 11:19:09.631417,2024-04-22 11:19:25.020609,0 days 00:00:15.389192,0.14816911767172675,455.0,277.0,True,4,3,0.00028618404945157666,,3,Adam,0.0005422932140045345,COMPLETE
439,1.0445978045463562,2024-04-22 11:19:25.020963,2024-04-22 11:19:40.411919,0 days 00:00:15.390956,0.15107438222182287,458.0,272.0,True,4,3,0.00039741381625468754,,3,Adam,0.0006022387995031302,COMPLETE
440,0.8051648437976837,2024-04-22 11:19:40.412245,2024-04-22 11:19:55.778036,0 days 00:00:15.365791,0.14764698652877356,469.0,,True,4,3,0.00028360297001835577,,2,Adam,0.0005121216669918379,COMPLETE
441,1.1667166352272034,2024-04-22 11:19:55.778375,2024-04-22 11:20:11.159760,0 days 00:00:15.381385,0.1382816107782876,450.0,286.0,True,4,3,0.0003461384024227758,,3,Adam,0.00045494860058489794,COMPLETE
442,0.9409438669681549,2024-04-22 11:20:11.160117,2024-04-22 11:20:26.621738,0 days 00:00:15.461621,0.15785474190208634,477.0,279.0,True,4,3,0.0004556599345809295,,3,Adam,0.0006591190082967141,COMPLETE
443,0.9927639067173004,2024-04-22 11:20:26.622085,2024-04-22 11:20:42.023535,0 days 00:00:15.401450,0.18445577891022,495.0,272.0,True,4,3,0.0003047792670769556,,3,Adam,0.0005771721611696075,COMPLETE
444,0.8492059409618378,2024-04-22 11:20:42.023859,2024-04-22 11:20:57.456423,0 days 00:00:15.432564,0.17635058077198865,525.0,286.0,True,4,3,0.0002605225390855847,,3,Adam,0.0005385209355418637,COMPLETE
445,0.9212185144424438,2024-04-22 11:20:57.456736,2024-04-22 11:21:12.626488,0 days 00:00:15.169752,0.16705389188182626,449.0,293.0,True,3,3,0.0002248202193799458,,3,Adam,0.0006755486533198497,COMPLETE
446,1.0621141195297241,2024-04-22 11:21:12.626825,2024-04-22 11:21:28.072689,0 days 00:00:15.445864,0.1498350851397817,479.0,279.0,True,4,3,0.00029398075116060074,,3,Adam,0.00045010486893801215,COMPLETE
447,1.174217164516449,2024-04-22 11:21:28.073026,2024-04-22 11:21:43.333499,0 days 00:00:15.260473,0.04565553470050038,,,False,4,3,0.00021260340882640175,,1,Adam,0.0007724243401896963,COMPLETE
448,0.8406509757041931,2024-04-22 11:21:43.333827,2024-04-22 11:21:58.745546,0 days 00:00:15.411719,0.16109015084302422,508.0,270.0,True,4,3,0.00024531952336098565,,3,Adam,0.0005498652207365554,COMPLETE
449,1.0062942206859589,2024-04-22 11:21:58.745871,2024-04-22 11:22:14.108523,0 days 00:00:15.362652,0.14492156704435175,456.0,265.0,True,4,3,0.00017619774306744994,,3,Adam,0.0006769294202492469,COMPLETE
450,0.8187637329101562,2024-04-22 11:22:14.108853,2024-04-22 11:22:29.527452,0 days 00:00:15.418599,0.12994578960853911,533.0,,True,4,3,0.00037523940753385755,,2,Adam,0.000514482775425854,COMPLETE
451,0.8691269755363464,2024-04-22 11:22:29.527766,2024-04-22 11:22:44.995715,0 days 00:00:15.467949,0.18604213495226063,487.0,288.0,True,4,3,0.00019790677133756448,,3,Adam,0.0006296905690309056,COMPLETE
452,1.0490691661834717,2024-04-22 11:22:44.996040,2024-04-22 11:23:00.411993,0 days 00:00:15.415953,0.1735411514953495,466.0,278.0,True,4,3,0.0002675170309047137,,3,Adam,0.0008187567785452796,COMPLETE
453,0.8520069718360901,2024-04-22 11:23:00.412334,2024-04-22 11:23:15.812708,0 days 00:00:15.400374,0.1552126631989802,513.0,291.0,True,4,3,0.00013534641196380967,,3,Adam,0.00038553632654831824,COMPLETE
454,0.8913406729698181,2024-04-22 11:23:15.813032,2024-04-22 11:23:31.201811,0 days 00:00:15.388779,0.13808455050442453,559.0,254.0,True,4,3,0.0002279613862227411,,3,Adam,0.00046302479716372113,COMPLETE
455,0.8606309294700623,2024-04-22 11:23:31.202131,2024-04-22 11:23:46.628739,0 days 00:00:15.426608,0.19508671127782098,437.0,265.0,True,4,3,0.0001570358802131054,,3,Adam,0.0005882844837377534,COMPLETE
456,1.1137178540229797,2024-04-22 11:23:46.629064,2024-04-22 11:24:02.032681,0 days 00:00:15.403617,0.1631958036949182,500.0,276.0,True,4,3,0.000290938329087026,,3,Adam,0.0006973532569744617,COMPLETE
457,0.8897970020771027,2024-04-22 11:24:02.033021,2024-04-22 11:24:17.430152,0 days 00:00:15.397131,0.1807911857784062,530.0,260.0,True,4,3,0.00019292063784117827,,3,Adam,0.00047885347981509966,COMPLETE
458,0.8440739512443542,2024-04-22 11:24:17.430478,2024-04-22 11:24:32.859426,0 days 00:00:15.428948,0.2265867914317863,542.0,337.0,True,4,3,0.00024095742440753906,,3,Adam,0.0005767381179160388,COMPLETE
459,0.9673512578010559,2024-04-22 11:24:32.859760,2024-04-22 11:24:48.319630,0 days 00:00:15.459870,0.2126859881877911,478.0,,True,4,3,0.00017445809641332207,,2,Adam,0.0007501905989153064,COMPLETE
460,1.0083042681217194,2024-04-22 11:24:48.319961,2024-04-22 11:25:03.711316,0 days 00:00:15.391355,0.2354075319809522,512.0,245.0,True,4,3,0.0002028347392789596,,3,Adam,0.000410144582039257,COMPLETE
461,0.8884558379650116,2024-04-22 11:25:03.711667,2024-04-22 11:25:19.149455,0 days 00:00:15.437788,0.17041922463866727,572.0,238.0,True,4,3,0.000344354210720009,,3,Adam,0.0008563235463353574,COMPLETE
462,0.7706953287124634,2024-04-22 11:25:19.149803,2024-04-22 11:25:34.594792,0 days 00:00:15.444989,0.0005695754403087921,462.0,283.0,True,4,3,0.00015652739785155772,,3,Adam,0.0005146388849332045,COMPLETE
463,0.8125107884407043,2024-04-22 11:25:34.595132,2024-04-22 11:25:50.000205,0 days 00:00:15.405073,0.0666252787472937,489.0,286.0,True,4,3,0.00013558054659800126,,3,Adam,0.0005795561823034107,COMPLETE
464,0.8955472707748413,2024-04-22 11:25:50.000537,2024-04-22 11:26:05.378376,0 days 00:00:15.377839,0.07326186938215032,460.0,282.0,True,4,3,0.0001540334329654634,,3,Adam,0.0006610340775179279,COMPLETE
465,1.0294654071331024,2024-04-22 11:26:05.378694,2024-04-22 11:26:20.858793,0 days 00:00:15.480099,0.03876525729323663,519.0,292.0,True,4,3,0.00015302905584242267,,3,Adam,0.0005020827799717387,COMPLETE
466,1.059636116027832,2024-04-22 11:26:20.859119,2024-04-22 11:26:36.265121,0 days 00:00:15.406002,0.016849826359200952,474.0,269.0,False,4,3,0.00026853441550920415,,3,Adam,0.0010046872997368746,COMPLETE
467,0.8241725564002991,2024-04-22 11:26:36.265477,2024-04-22 11:26:51.728041,0 days 00:00:15.462564,0.0281737517445406,547.0,324.0,True,4,3,0.00012206371683943529,,3,Adam,0.0005565997009159727,COMPLETE
468,1.1806719303131104,2024-04-22 11:26:51.728373,2024-04-22 11:27:07.172409,0 days 00:00:15.444036,0.0032516152065891492,498.0,295.0,True,4,3,0.00022012587260531133,,3,Adam,0.0007744639543268202,COMPLETE
469,1.0723128914833069,2024-04-22 11:27:07.172763,2024-04-22 11:27:22.611126,0 days 00:00:15.438363,0.09870679465589606,488.0,,True,4,3,3.001156598922191e-05,,2,Adam,0.0006452424951638573,COMPLETE
470,0.8733980655670166,2024-04-22 11:27:22.611462,2024-04-22 11:27:38.051367,0 days 00:00:15.439905,0.0789830784629062,527.0,284.0,True,4,3,0.00017100640740282949,,3,Adam,0.0027318981320353323,COMPLETE
471,0.9274564683437347,2024-04-22 11:27:38.051706,2024-04-22 11:27:53.540291,0 days 00:00:15.488585,0.05524177504028181,558.0,336.0,True,4,3,0.00013804815019979172,,3,Adam,0.0004874037852513073,COMPLETE
472,0.878084808588028,2024-04-22 11:27:53.540620,2024-04-22 11:28:08.977003,0 days 00:00:15.436383,0.208395679657089,465.0,296.0,True,4,3,0.0002947315991745112,,3,Adam,0.0006124910200119373,COMPLETE
473,0.968407541513443,2024-04-22 11:28:08.977343,2024-04-22 11:28:24.448032,0 days 00:00:15.470689,0.11689542021197165,503.0,273.0,True,4,3,0.00021291676921274968,,3,Adam,0.0007382446313204384,COMPLETE
474,1.3661448955535889,2024-04-22 11:28:24.448370,2024-04-22 11:28:39.909782,0 days 00:00:15.461412,0.15098246168238866,589.0,330.0,True,4,3,1.309070170422097e-05,,3,Adam,0.0005381168493454351,COMPLETE
475,0.9238502383232117,2024-04-22 11:28:39.910120,2024-04-22 11:28:55.390513,0 days 00:00:15.480393,0.025551487086865575,537.0,175.0,True,4,3,0.00024442978313781957,,3,Adam,0.0008412744896064985,COMPLETE
476,0.8267819583415985,2024-04-22 11:28:55.390838,2024-04-22 11:29:10.881044,0 days 00:00:15.490206,0.16137206716372626,512.0,263.0,True,4,3,0.00018193082766928794,,3,Adam,0.0006435746503359637,COMPLETE
477,1.1235362887382507,2024-04-22 11:29:10.881401,2024-04-22 11:29:26.274309,0 days 00:00:15.392908,0.13596047136758865,441.0,277.0,True,4,3,0.00032280861588337425,,3,Adam,0.0005218625124577904,COMPLETE
478,0.9114934206008911,2024-04-22 11:29:26.274640,2024-04-22 11:29:41.703641,0 days 00:00:15.429001,0.009730696250794514,478.0,284.0,True,4,3,0.00015331795061754734,,3,Adam,0.0004476756274411963,COMPLETE
479,0.8398476839065552,2024-04-22 11:29:41.703971,2024-04-22 11:29:57.099070,0 days 00:00:15.395099,0.18697134333090093,458.0,298.0,True,4,3,0.00020427159973453616,,3,Adam,0.0010410482281340413,COMPLETE
480,0.8132764101028442,2024-04-22 11:29:57.099393,2024-04-22 11:30:12.538235,0 days 00:00:15.438842,0.2021060279136529,571.0,,True,4,3,0.00024775508826243426,,2,Adam,0.0006618107390560604,COMPLETE
481,0.9800300896167755,2024-04-22 11:30:12.538563,2024-04-22 11:30:28.001378,0 days 00:00:15.462815,0.23755523228848224,490.0,291.0,True,4,3,0.0001745929895622265,,3,Adam,0.0005575966650240968,COMPLETE
482,1.0998387932777405,2024-04-22 11:30:28.001730,2024-04-22 11:30:43.493452,0 days 00:00:15.491722,0.17585455103766104,547.0,253.0,True,4,3,0.0005134300184347761,,3,Adam,0.0007432202573679679,COMPLETE
483,0.9627841413021088,2024-04-22 11:30:43.493810,2024-04-22 11:30:58.986501,0 days 00:00:15.492691,0.15516516127991378,519.0,345.0,True,4,3,0.00012578568607641045,,3,Adam,0.000455931885716025,COMPLETE
484,1.1191608309745789,2024-04-22 11:30:58.986826,2024-04-22 11:31:14.326959,0 days 00:00:15.340133,0.14397990311801423,180.0,178.0,True,4,5,0.0002670923474881207,,3,Adam,0.0015367705320677078,COMPLETE
485,1.1778940558433533,2024-04-22 11:31:14.327291,2024-04-22 11:31:29.578201,0 days 00:00:15.250910,0.0859054841481744,429.0,158.0,False,4,3,0.00021107637236565368,,3,Adam,0.0006371849993706725,COMPLETE
486,0.8775180280208588,2024-04-22 11:31:29.578549,2024-04-22 11:31:45.098801,0 days 00:00:15.520252,0.24847230959742445,,,True,5,3,0.00037048706666265426,,1,Adam,0.0008615516591177918,COMPLETE
487,0.8825091123580933,2024-04-22 11:31:45.099130,2024-04-22 11:32:00.502394,0 days 00:00:15.403264,0.1925705526522593,500.0,,True,4,3,0.0002290888368009038,,2,Adam,0.0005291840182312073,COMPLETE
488,1.0103203654289246,2024-04-22 11:32:00.502725,2024-04-22 11:32:15.906522,0 days 00:00:15.403797,0.1088000891622597,478.0,270.0,True,4,3,0.00016507294159539702,,3,Adam,0.0021017380487084155,COMPLETE
489,0.9287561774253845,2024-04-22 11:32:15.906850,2024-04-22 11:32:31.369168,0 days 00:00:15.462318,0.12823270534034426,533.0,323.0,True,4,3,0.0003029217350362962,,3,Adam,0.000705202124411769,COMPLETE
490,0.8608123958110809,2024-04-22 11:32:31.369507,2024-04-22 11:32:46.797662,0 days 00:00:15.428155,0.22435931326170183,459.0,281.0,True,4,3,0.00019181569914120068,,3,Adam,0.0018224115610877619,COMPLETE
491,0.9432382881641388,2024-04-22 11:32:46.798018,2024-04-22 11:33:02.265682,0 days 00:00:15.467664,0.16726070787349684,560.0,338.0,True,4,3,0.00015144881628511453,,3,Adam,0.0005945591990167833,COMPLETE
492,0.8171006441116333,2024-04-22 11:33:02.266023,2024-04-22 11:33:17.651284,0 days 00:00:15.385261,0.24089953620225565,510.0,354.0,True,4,3,0.0002485622683951206,,3,Adam,0.00043787759602676254,COMPLETE
493,0.7307896316051483,2024-04-22 11:33:17.651603,2024-04-22 11:33:33.166799,0 days 00:00:15.515196,0.17843187895019205,585.0,319.0,True,4,3,0.00019169006070656594,,3,Adam,0.0009435062218724154,COMPLETE
494,0.8157816231250763,2024-04-22 11:33:33.167130,2024-04-22 11:33:48.657877,0 days 00:00:15.490747,0.18098463871565823,593.0,320.0,True,4,3,0.00021786795751646662,,3,Adam,0.0010927641307721028,COMPLETE
495,0.9642248749732971,2024-04-22 11:33:48.658227,2024-04-22 11:34:04.085937,0 days 00:00:15.427710,0.1755608555426211,578.0,331.0,True,4,3,0.00028086942262330386,,3,Adam,0.0009384451632650455,COMPLETE
496,0.8621125817298889,2024-04-22 11:34:04.086286,2024-04-22 11:34:19.461866,0 days 00:00:15.375580,0.19224527660881893,577.0,331.0,True,3,3,0.00019653293092446216,,3,Adam,0.0009318794457665993,COMPLETE
497,0.8725121915340424,2024-04-22 11:34:19.462177,2024-04-22 11:34:34.957710,0 days 00:00:15.495533,0.16483730094163115,617.0,,True,4,3,0.0002390775633696288,,2,Adam,0.0008258341506300542,COMPLETE
498,0.8400720357894897,2024-04-22 11:34:34.958064,2024-04-22 11:34:50.384120,0 days 00:00:15.426056,0.1798515922046817,552.0,139.0,True,4,3,0.00018257723352085284,,3,Adam,0.0010594921338780174,COMPLETE
499,0.8525528311729431,2024-04-22 11:34:50.384461,2024-04-22 11:35:05.852720,0 days 00:00:15.468259,0.20384216761145954,598.0,317.0,True,4,3,0.0002205314389836162,,3,Adam,0.0012542092159273399,COMPLETE
500,0.8303358256816864,2024-04-22 11:35:05.853056,2024-04-22 11:35:21.363912,0 days 00:00:15.510856,0.15743455392160136,562.0,341.0,True,4,3,0.0003291265704380811,,3,Adam,0.0007776472255380146,COMPLETE
501,0.9166465103626251,2024-04-22 11:35:21.364273,2024-04-22 11:35:37.114396,0 days 00:00:15.750123,0.1703528410254055,881.0,234.0,True,4,3,0.00026577435723320795,,3,Adam,0.0009505040976449687,COMPLETE
502,0.7204019129276276,2024-04-22 11:35:37.114721,2024-04-22 11:35:52.597819,0 days 00:00:15.483098,0.18869332445208015,534.0,312.0,True,4,3,0.00019204775961069752,,3,Adam,0.0014010950948049798,COMPLETE
503,1.0337983667850494,2024-04-22 11:35:52.598161,2024-04-22 11:36:08.023000,0 days 00:00:15.424839,0.189320625746496,540.0,,True,4,3,0.000173833081510639,,2,Adam,0.0015415636243354526,COMPLETE
504,0.9255971312522888,2024-04-22 11:36:08.023334,2024-04-22 11:36:23.464624,0 days 00:00:15.441290,0.19361432839629258,529.0,315.0,True,4,3,0.00013764908205639762,,3,Adam,0.001267255367050081,COMPLETE
505,1.1570098996162415,2024-04-22 11:36:23.464961,2024-04-22 11:36:38.906135,0 days 00:00:15.441174,0.20066248440852721,573.0,315.0,False,4,3,0.0001874409679429812,,3,Adam,0.0013640161682172635,COMPLETE
506,0.8708881139755249,2024-04-22 11:36:38.906513,2024-04-22 11:36:54.359415,0 days 00:00:15.452902,0.183428546525686,543.0,324.0,True,4,3,0.00020100623952936175,,3,Adam,0.0016842885936266497,COMPLETE
507,0.865303099155426,2024-04-22 11:36:54.359775,2024-04-22 11:37:09.795893,0 days 00:00:15.436118,0.1702587644656952,523.0,298.0,True,4,3,0.00017351019771599715,,3,Adam,0.0014266791491834919,COMPLETE
508,1.0091581344604492,2024-04-22 11:37:09.796229,2024-04-22 11:37:25.286908,0 days 00:00:15.490679,0.1465858616733589,588.0,324.0,True,4,3,0.00014296315096402063,,3,Adam,0.0016726373432730678,COMPLETE
509,1.0856397151947021,2024-04-22 11:37:25.287241,2024-04-22 11:37:40.787031,0 days 00:00:15.499790,0.17995725795762801,556.0,312.0,True,4,3,0.00028616807026693263,,3,Adam,0.0012082794161754802,COMPLETE
510,1.0305736660957336,2024-04-22 11:37:40.787385,2024-04-22 11:37:56.315631,0 days 00:00:15.528246,0.15887934071018303,522.0,302.0,True,4,3,0.0004020999739072669,,3,Adam,0.0019832328151411487,COMPLETE
511,0.7503529191017151,2024-04-22 11:37:56.315982,2024-04-22 11:38:11.763224,0 days 00:00:15.447242,0.13783219530051785,606.0,334.0,True,4,3,0.00021324072638244468,,3,Adam,0.0014315892122225174,COMPLETE
512,0.8697943985462189,2024-04-22 11:38:11.763554,2024-04-22 11:38:27.261420,0 days 00:00:15.497866,0.12052150603261418,625.0,332.0,True,4,3,0.0002456217593182554,,3,Adam,0.0011696203222133295,COMPLETE
513,0.9150287806987762,2024-04-22 11:38:27.261763,2024-04-22 11:38:42.699654,0 days 00:00:15.437891,0.14788007786035867,500.0,347.0,True,4,3,0.00021041665382274605,,3,Adam,0.0013402257596969512,COMPLETE
514,0.9899953901767731,2024-04-22 11:38:42.700020,2024-04-22 11:38:58.116263,0 days 00:00:15.416243,0.136594503570502,614.0,,True,4,3,0.00023598409116675766,,2,Adam,0.0007149220272738594,COMPLETE
515,0.9429644048213959,2024-04-22 11:38:58.116592,2024-04-22 11:39:13.640813,0 days 00:00:15.524221,0.13107538313711886,636.0,325.0,True,4,3,0.0002001060498788956,,3,Adam,0.0006304836790948091,COMPLETE
516,0.9895371198654175,2024-04-22 11:39:13.641165,2024-04-22 11:39:29.229747,0 days 00:00:15.588582,0.15177806802076269,606.0,246.0,True,4,5,0.00027815149393836506,,3,Adam,0.0014492315499596213,COMPLETE
517,0.7123993337154388,2024-04-22 11:39:29.230120,2024-04-22 11:39:44.666575,0 days 00:00:15.436455,0.13693047083155022,509.0,,True,4,3,0.00023042060029788319,,2,Adam,0.0010968270340033,COMPLETE
518,0.8932032883167267,2024-04-22 11:39:44.666903,2024-04-22 11:40:00.159646,0 days 00:00:15.492743,0.13449169990432636,542.0,,True,4,3,0.00031538325078411616,,2,Adam,0.0012135488843939342,COMPLETE
519,0.9570655822753906,2024-04-22 11:40:00.159983,2024-04-22 11:40:15.657126,0 days 00:00:15.497143,0.12053506611379128,520.0,,True,4,3,0.0002442936186827032,,2,Adam,0.0010931166877637295,COMPLETE
520,1.078045815229416,2024-04-22 11:40:15.657487,2024-04-22 11:40:31.086347,0 days 00:00:15.428860,0.1417612551757929,510.0,,True,4,3,0.00027258473389462387,,2,Adam,0.0010544443577442401,COMPLETE
521,0.9000763297080994,2024-04-22 11:40:31.086695,2024-04-22 11:40:46.593000,0 days 00:00:15.506305,0.14020860193043727,554.0,,True,4,3,0.0002374327322582387,,2,Adam,0.001093567793886046,COMPLETE
522,0.9085415005683899,2024-04-22 11:40:46.593326,2024-04-22 11:41:02.124795,0 days 00:00:15.531469,0.128088835742815,537.0,,True,4,3,0.0002135040825287951,,2,Adam,0.0013414379481694614,COMPLETE
523,0.9808244407176971,2024-04-22 11:41:02.125165,2024-04-22 11:41:17.614697,0 days 00:00:15.489532,0.163042736741289,594.0,,True,4,3,0.0003650446201029663,,2,Adam,0.0009947085935913399,COMPLETE
524,1.0806638598442078,2024-04-22 11:41:17.615025,2024-04-22 11:41:32.997579,0 days 00:00:15.382554,0.15596449176801558,500.0,,True,4,3,0.0003001151409770188,,2,Adam,0.0015046576285388193,COMPLETE
525,1.1509345173835754,2024-04-22 11:41:32.997910,2024-04-22 11:41:48.460739,0 days 00:00:15.462829,0.14536055087718563,578.0,,False,4,3,0.00020291622300814833,,2,Adam,0.001238174612886963,COMPLETE
526,0.8331189751625061,2024-04-22 11:41:48.461097,2024-04-22 11:42:03.876636,0 days 00:00:15.415539,0.11057646660530879,528.0,,True,4,3,0.00025377667742430897,,2,Adam,0.0008663781655711948,COMPLETE
527,1.0842930674552917,2024-04-22 11:42:03.876976,2024-04-22 11:42:19.325393,0 days 00:00:15.448417,0.18906189519166589,513.0,,True,4,3,0.00022692189302435175,,2,Adam,0.0009773261272814197,COMPLETE
528,0.7553637325763702,2024-04-22 11:42:19.325710,2024-04-22 11:42:34.825655,0 days 00:00:15.499945,0.17336847480312342,560.0,,True,4,3,0.00019614119816774032,,2,Adam,0.0007805487555338143,COMPLETE
