number,value,datetime_start,datetime_complete,duration,params_dropout_p,params_hidden_weights0,params_hidden_weights1,params_initializers,params_kernel1,params_kernel2,params_learning_rate,params_momentum,params_n_fc_layers,params_optimizer,params_weight_decays,state
966,0.9662472009658813,2024-04-22 13:38:43.741923,2024-04-22 13:38:59.987733,0 days 00:00:16.245810,0.15933682150603878,544.0,,True,4,3,0.00019829474979670412,,2,Adam,0.000292781734784761,COMPLETE
967,1.2337170839309692,2024-04-22 13:38:59.988142,2024-04-22 13:39:16.283767,0 days 00:00:16.295625,0.23805646685980697,579.0,525.0,False,4,3,0.00015192918164709182,,3,Adam,0.0002513090528073545,COMPLETE
968,0.7029115855693817,2024-04-22 13:39:16.284197,2024-04-22 13:39:32.521558,0 days 00:00:16.237361,0.17640726618278557,509.0,,True,4,3,0.00024878010324307613,,2,Adam,0.0007454126355869457,COMPLETE
969,0.8801530599594116,2024-04-22 13:39:32.521991,2024-04-22 13:39:48.809959,0 days 00:00:16.287968,0.18117776643153177,507.0,,True,4,3,0.0003227451248538436,,2,Adam,0.0007976284481735819,COMPLETE
970,1.085009902715683,2024-04-22 13:39:48.810362,2024-04-22 13:40:05.005976,0 days 00:00:16.195614,0.17288107239282735,510.0,445.0,True,4,3,0.0002787482614946714,,3,Adam,0.0005333641866596355,COMPLETE
971,0.9019321203231812,2024-04-22 13:40:05.006363,2024-04-22 13:40:21.404805,0 days 00:00:16.398442,0.18160470452446037,509.0,,True,5,3,0.00033511895138508353,,2,Adam,0.000638448143512305,COMPLETE
972,1.5499956607818604,2024-04-22 13:40:21.405207,2024-04-22 13:40:37.541864,0 days 00:00:16.136657,0.1911204879928961,522.0,,True,4,3,0.00026182835018088687,0.855781944213105,2,SGD,0.0007258407839833074,COMPLETE
973,1.1130167245864868,2024-04-22 13:40:37.542293,2024-04-22 13:40:53.633519,0 days 00:00:16.091226,0.17389393148639415,,,True,4,4,0.00028364128532510106,,1,Adam,0.0006566961928395946,COMPLETE
974,3.66812264919281,2024-04-22 13:40:53.633941,2024-04-22 13:41:09.829132,0 days 00:00:16.195191,0.16857198652620226,527.0,457.0,True,4,3,0.00329857741942919,,3,Adam,0.000598763227264693,COMPLETE
975,0.904474288225174,2024-04-22 13:41:09.829526,2024-04-22 13:41:26.063479,0 days 00:00:16.233953,0.19258762907050742,508.0,,True,4,3,0.0002463837005968566,,2,Adam,0.0006990724355404919,COMPLETE
976,0.982035368680954,2024-04-22 13:41:26.063849,2024-04-22 13:41:42.278643,0 days 00:00:16.214794,0.18013025355104395,536.0,,True,4,3,0.0003816216778604039,,2,Adam,0.0004709472923948875,COMPLETE
977,0.8094543218612671,2024-04-22 13:41:42.279039,2024-04-22 13:41:58.464250,0 days 00:00:16.185211,0.20502545626938076,496.0,427.0,True,4,3,0.00024393741292013773,,3,Adam,0.0007448234644156269,COMPLETE
978,1.0008754432201385,2024-04-22 13:41:58.464662,2024-04-22 13:42:14.614289,0 days 00:00:16.149627,0.16687873814002221,491.0,,True,4,3,0.00030684863295397247,,2,Adam,0.00057530187007174,COMPLETE
979,0.9941788613796234,2024-04-22 13:42:14.614714,2024-04-22 13:42:30.775377,0 days 00:00:16.160663,0.18652162913665127,524.0,,True,4,3,0.00022214249852409707,,2,Adam,0.0007735971757407857,COMPLETE
980,1.0185499787330627,2024-04-22 13:42:30.775779,2024-04-22 13:42:47.039845,0 days 00:00:16.264066,0.17404280758712587,541.0,509.0,True,4,3,0.0002554425586725408,,3,Adam,0.0008267656143591358,COMPLETE
981,0.9696963429450989,2024-04-22 13:42:47.040279,2024-04-22 13:43:03.357271,0 days 00:00:16.316992,0.19633828117793278,675.0,,True,4,3,0.00022639448849695666,,2,Adam,0.0003078720922074284,COMPLETE
982,0.9654607176780701,2024-04-22 13:43:03.357660,2024-04-22 13:43:19.565397,0 days 00:00:16.207737,0.21460136555581583,514.0,,True,4,3,0.0003037318823545219,,2,Adam,0.00047657877001510785,COMPLETE
983,0.8170572519302368,2024-04-22 13:43:19.565794,2024-04-22 13:43:35.801159,0 days 00:00:16.235365,0.1615437470431331,553.0,217.0,True,4,3,0.00021468392703460928,,3,Adam,0.0008233443124406481,COMPLETE
984,0.8001808226108551,2024-04-22 13:43:35.801586,2024-04-22 13:43:51.988759,0 days 00:00:16.187173,0.22799635963669923,526.0,,True,4,3,0.00025887942588744125,,2,Adam,0.0006963844824643063,COMPLETE
985,1.0324547588825226,2024-04-22 13:43:51.989155,2024-04-22 13:44:08.240627,0 days 00:00:16.251472,0.1835571819487123,543.0,,True,4,3,0.00045059304665597455,,2,Adam,0.00023184958461246028,COMPLETE
986,1.0187350809574127,2024-04-22 13:44:08.241003,2024-04-22 13:44:24.493750,0 days 00:00:16.252747,0.2597952501949642,561.0,252.0,True,4,3,0.00034526517698974603,,3,Adam,0.0005942305914720762,COMPLETE
987,1.012937605381012,2024-04-22 13:44:24.494173,2024-04-22 13:44:40.668950,0 days 00:00:16.174777,0.20290865613099618,509.0,,False,4,3,0.00020041380082286907,,2,Adam,0.0008854357678405937,COMPLETE
988,0.8500917553901672,2024-04-22 13:44:40.669366,2024-04-22 13:44:56.837395,0 days 00:00:16.168029,0.24314702231715513,490.0,,True,4,3,0.00023371010586135864,,2,Adam,0.00088657948121955,COMPLETE
989,1.2173718214035034,2024-04-22 13:44:56.837805,2024-04-22 13:45:13.104300,0 days 00:00:16.266495,0.1939657095978019,530.0,478.0,True,4,3,0.00029224400224879326,,3,Adam,0.0032293898207705627,COMPLETE
990,1.5546324849128723,2024-04-22 13:45:13.104701,2024-04-22 13:45:29.034834,0 days 00:00:15.930133,0.17543700684731217,558.0,,True,3,3,0.000183664872762104,0.907248769094949,2,SGD,0.0003713681122848069,COMPLETE
991,1.0282244086265564,2024-04-22 13:45:29.035242,2024-04-22 13:45:45.261430,0 days 00:00:16.226188,0.28815727161730476,536.0,,True,4,3,0.00022036516505032192,,2,Adam,0.00021466141542163136,COMPLETE
992,0.9323069453239441,2024-04-22 13:45:45.261840,2024-04-22 13:46:01.627213,0 days 00:00:16.365373,0.2099329197808887,651.0,580.0,True,4,4,0.0002495515455283491,,3,Adam,0.00043361286829593444,COMPLETE
993,0.8920584619045258,2024-04-22 13:46:01.627583,2024-04-22 13:46:17.844686,0 days 00:00:16.217103,0.23138066099498192,567.0,,True,4,3,0.00028323083002521423,,2,Adam,0.0007346312132464987,COMPLETE
994,0.9448025524616241,2024-04-22 13:46:17.845117,2024-04-22 13:46:34.080396,0 days 00:00:16.235279,0.1637426575894653,553.0,,True,4,3,0.00016776765472139636,,2,Adam,0.0002921108990080543,COMPLETE
995,0.9566270709037781,2024-04-22 13:46:34.080807,2024-04-22 13:46:50.301699,0 days 00:00:16.220892,0.26603057528968216,510.0,,True,4,3,3.763590964500326e-05,,2,Adam,0.0009296857893666753,COMPLETE
996,1.0822128653526306,2024-04-22 13:46:50.302100,2024-04-22 13:47:06.555196,0 days 00:00:16.253096,0.18082839690308844,596.0,241.0,True,4,3,0.0002023117070253132,,3,Adam,0.0005519347150564509,COMPLETE
997,0.7804079055786133,2024-04-22 13:47:06.555614,2024-04-22 13:47:22.761289,0 days 00:00:16.205675,0.21829646320694857,624.0,,True,4,3,0.00023720358578828627,,2,Adam,0.0006564690957923115,COMPLETE
998,0.8274188339710236,2024-04-22 13:47:22.761682,2024-04-22 13:47:39.057635,0 days 00:00:16.295953,0.24956179971144085,544.0,,True,4,3,0.0001859454533039612,,2,Adam,0.0003243152507809481,COMPLETE
999,0.8689230382442474,2024-04-22 13:47:39.058038,2024-04-22 13:47:55.314691,0 days 00:00:16.256653,0.18808341455629057,572.0,250.0,True,4,3,0.0001324191267401592,,3,Adam,0.000999064662935819,COMPLETE
