number,value,datetime_start,datetime_complete,duration,params_dropout_p,params_hidden_weights0,params_hidden_weights1,params_initializers,params_kernel1,params_kernel2,params_learning_rate,params_momentum,params_n_fc_layers,params_optimizer,params_weight_decays,state
0,1.1351591348648071,2024-04-22 09:27:09.548986,2024-04-22 09:27:25.083555,0 days 00:00:15.534569,0.18487344103051662,991.0,965.0,False,4,5,0.00013903839633706857,,3,Adam,0.00021516558869170266,COMPLETE
1,1.6387042999267578,2024-04-22 09:27:25.083867,2024-04-22 09:27:39.759002,0 days 00:00:14.675135,0.2944512594644304,,,True,3,4,8.472130512080181e-05,0.8162287770788509,1,SGD,0.0018767421250418604,COMPLETE
2,0.8895121514797211,2024-04-22 09:27:39.759305,2024-04-22 09:27:54.570012,0 days 00:00:14.810707,0.28618579811326994,,,True,4,3,0.001307155867195669,0.9802893798407065,1,SGD,0.00025777742808440093,COMPLETE
3,2.1197471618652344,2024-04-22 09:27:54.570280,2024-04-22 09:28:09.805411,0 days 00:00:15.235131,0.22501345437274067,866.0,,False,4,5,0.0005225359689877879,0.9987022551014471,2,SGD,1.7511353334368974e-05,COMPLETE
4,2.302102208137512,2024-04-22 09:28:09.805674,2024-04-22 09:28:25.218708,0 days 00:00:15.413034,0.15372758090861827,645.0,392.0,True,5,4,0.003028611925069706,,3,Adam,0.00011758725496170086,COMPLETE
5,2.1305530071258545,2024-04-22 09:28:25.218966,2024-04-22 09:28:40.223423,0 days 00:00:15.004457,0.37650653635050885,,,True,4,4,1.2057919466159218e-05,0.8709871672920861,1,SGD,5.082034362085087e-05,COMPLETE
6,2.2998610734939575,2024-04-22 09:28:40.223684,2024-04-22 09:28:55.321911,0 days 00:00:15.098227,0.17353171776829474,930.0,428.0,False,3,4,0.00022277010053236312,0.8164872135493558,3,SGD,0.000666755121656217,COMPLETE
7,1.3881425261497498,2024-04-22 09:28:55.322199,2024-04-22 09:29:10.117585,0 days 00:00:14.795386,0.4493240481766822,,,False,3,4,0.0001046625505949604,,1,Adam,0.0007185001321008655,COMPLETE
8,1.955086886882782,2024-04-22 09:29:10.117849,2024-04-22 09:29:25.079230,0 days 00:00:14.961381,0.08719068545478037,413.0,314.0,False,3,4,0.0011514132866845088,,3,Adam,1.527773532420579e-05,COMPLETE
9,1.9164080619812012,2024-04-22 09:29:25.079532,2024-04-22 09:29:40.411045,0 days 00:00:15.331513,0.008812116583897855,590.0,,False,5,3,0.00034583203936917255,0.9947683338181771,2,SGD,0.005209348373056352,COMPLETE
10,1.4309656620025635,2024-04-22 09:29:40.411310,2024-04-22 09:29:55.539285,0 days 00:00:15.127975,0.3325098226252868,,,True,5,3,0.009817734298249989,0.9327741063212595,1,SGD,0.007331321386166921,COMPLETE
11,1.1486101150512695,2024-04-22 09:29:55.539541,2024-04-22 09:30:10.669759,0 days 00:00:15.130218,0.2355241065202189,148.0,,True,4,5,3.7877514743912415e-05,,2,Adam,0.00021694807103570627,COMPLETE
12,1.4323503375053406,2024-04-22 09:30:10.670018,2024-04-22 09:30:26.166823,0 days 00:00:15.496805,0.3815749727530542,782.0,779.0,True,4,5,0.0016245623471401042,,3,Adam,7.746607139647892e-05,COMPLETE
13,1.7127525210380554,2024-04-22 09:30:26.167117,2024-04-22 09:30:41.264127,0 days 00:00:15.097010,0.12690096424634656,351.0,,False,4,3,0.0008032946997552443,,2,Adam,0.0003497622985447433,COMPLETE
14,1.4993203282356262,2024-04-22 09:30:41.264374,2024-04-22 09:30:56.490506,0 days 00:00:15.226132,0.4920633128683982,741.0,,False,4,3,0.00357897552514232,0.9347992713843425,2,SGD,0.0012103904894350769,COMPLETE
15,1.0468433201313019,2024-04-22 09:30:56.490764,2024-04-22 09:31:12.284383,0 days 00:00:15.793619,0.27892299095189144,987.0,979.0,True,5,5,0.00020489715784499597,,3,Adam,0.0002434399458733611,COMPLETE
16,1.555658996105194,2024-04-22 09:31:12.284655,2024-04-22 09:31:27.452620,0 days 00:00:15.167965,0.3339427984105657,,,True,5,3,4.0764331017478135e-05,0.9482887930161903,1,SGD,4.2120306496985516e-05,COMPLETE
17,2.301516056060791,2024-04-22 09:31:27.452888,2024-04-22 09:31:42.935652,0 days 00:00:15.482764,0.27851581283212107,380.0,,True,5,5,0.008175016238843607,,2,Adam,0.0025132001681181923,COMPLETE
18,1.5990896821022034,2024-04-22 09:31:42.935925,2024-04-22 09:31:58.304926,0 days 00:00:15.369001,0.40368341399214724,100.0,,True,5,4,0.0022071107803871247,,2,Adam,0.0005933474427886132,COMPLETE
19,1.4876537919044495,2024-04-22 09:31:58.305217,2024-04-22 09:32:13.532050,0 days 00:00:15.226833,0.2948812149094443,515.0,176.0,True,4,5,0.0005389137068261147,0.8779178041345719,3,SGD,0.0001329924300225806,COMPLETE
20,1.0681019723415375,2024-04-22 09:32:13.532351,2024-04-22 09:32:28.804317,0 days 00:00:15.271966,0.22103154212544085,,,True,5,3,0.00023796453055188594,0.9587319750039723,1,SGD,2.8691257060152383e-05,COMPLETE
21,1.1628472805023193,2024-04-22 09:32:28.804569,2024-04-22 09:32:44.044858,0 days 00:00:15.240289,0.21954720278749412,,,True,5,3,0.000251876506877102,0.9636741597022277,1,SGD,3.578412641870511e-05,COMPLETE
22,1.319599688053131,2024-04-22 09:32:44.045162,2024-04-22 09:32:59.245249,0 days 00:00:15.200087,0.2655970402987601,,,True,5,3,6.146226791229971e-05,0.9680977178021474,1,SGD,1.0477440449552196e-05,COMPLETE
23,1.2628133296966553,2024-04-22 09:32:59.245514,2024-04-22 09:33:14.434947,0 days 00:00:15.189433,0.32960204653098313,,,True,5,3,0.00018228929444340144,0.9038316547366471,1,SGD,0.0003054227390096157,COMPLETE
24,1.1142879128456116,2024-04-22 09:33:14.435195,2024-04-22 09:33:29.633972,0 days 00:00:15.198777,0.08278711809193662,,,True,5,3,0.000491982223372267,0.9112708042238169,1,SGD,2.477534927375564e-05,COMPLETE
25,1.0639969408512115,2024-04-22 09:33:29.634239,2024-04-22 09:33:44.597907,0 days 00:00:14.963668,0.18882960902437307,,,True,4,3,0.0010770312855268684,0.9795504537171872,1,SGD,9.739074475739866e-05,COMPLETE
26,1.451994776725769,2024-04-22 09:33:44.598205,2024-04-22 09:33:59.991621,0 days 00:00:15.393416,0.1925589617071658,761.0,,True,4,4,0.0011086999318010754,,2,Adam,8.757904210571614e-05,COMPLETE
27,2.546979308128357,2024-04-22 09:33:59.991886,2024-04-22 09:34:15.376983,0 days 00:00:15.385097,0.1394013079496537,857.0,,True,4,4,0.004220766042710609,0.9841348429050908,2,SGD,0.0001642865076859537,COMPLETE
28,1.0855100452899933,2024-04-22 09:34:15.377243,2024-04-22 09:34:30.219915,0 days 00:00:14.842672,0.2654830060519202,,,True,3,3,0.0010583783635751461,,1,Adam,0.0003982533750600749,COMPLETE
29,1.5906217694282532,2024-04-22 09:34:30.220184,2024-04-22 09:34:45.488896,0 days 00:00:15.268712,0.0818226922068937,287.0,105.0,True,4,5,0.0007036135145712873,,3,Adam,6.856680795035704e-05,COMPLETE
30,0.9626270830631256,2024-04-22 09:34:45.489166,2024-04-22 09:35:00.757400,0 days 00:00:15.268234,0.3214414182876957,517.0,451.0,True,4,5,0.0020819391424664753,0.8580071216780031,3,SGD,0.00019981576099821935,COMPLETE
31,1.364552080631256,2024-04-22 09:35:00.757687,2024-04-22 09:35:16.041099,0 days 00:00:15.283412,0.34923095486144146,515.0,458.0,True,4,5,0.001762686415644909,0.8451501641064194,3,SGD,0.00019180690995801168,COMPLETE
32,1.2398289442062378,2024-04-22 09:35:16.041365,2024-04-22 09:35:31.355177,0 days 00:00:15.313812,0.30234218407007885,634.0,537.0,True,4,5,0.0067288142423844845,0.8571107915297903,3,SGD,0.000243174307348875,COMPLETE
33,1.3574607968330383,2024-04-22 09:35:31.355477,2024-04-22 09:35:46.536392,0 days 00:00:15.180915,0.24996576644231744,218.0,175.0,True,4,5,0.0022285083894973343,0.8328573290556381,3,SGD,0.0004393289717411342,COMPLETE
34,1.3775523900985718,2024-04-22 09:35:46.536701,2024-04-22 09:36:01.781450,0 days 00:00:15.244749,0.19106246837070767,453.0,281.0,True,4,5,0.0003830296024289919,0.8903910828121082,3,SGD,0.00011254656073200395,COMPLETE
35,1.785882294178009,2024-04-22 09:36:01.781719,2024-04-22 09:36:17.062426,0 days 00:00:15.280707,0.31033034039925644,684.0,580.0,True,4,4,0.00013015015931901267,0.9257819841980123,3,SGD,0.0011403068646886824,COMPLETE
36,2.2057932019233704,2024-04-22 09:36:17.062701,2024-04-22 09:36:32.032693,0 days 00:00:14.969992,0.4148156156046352,,,True,3,5,0.004870962341996643,0.9770335950687407,1,SGD,0.00015842845888851723,COMPLETE
37,0.9276537299156189,2024-04-22 09:36:32.032971,2024-04-22 09:36:47.302846,0 days 00:00:15.269875,0.36132431170771034,555.0,254.0,True,4,4,0.002498724100397286,0.9487433817747232,3,SGD,5.622348253799274e-05,COMPLETE
38,1.712544560432434,2024-04-22 09:36:47.303102,2024-04-22 09:37:02.443750,0 days 00:00:15.140648,0.3737701392322038,538.0,256.0,True,3,4,0.002763896474297388,,3,Adam,0.0009121401374110537,COMPLETE
39,2.3013951778411865,2024-04-22 09:37:02.444032,2024-04-22 09:37:17.681347,0 days 00:00:15.237315,0.3537192992146303,469.0,235.0,False,4,4,1.1846609528822341e-05,0.9516384097678118,3,SGD,5.111800739290109e-05,COMPLETE
40,1.0043034553527832,2024-04-22 09:37:17.681653,2024-04-22 09:37:32.933109,0 days 00:00:15.251456,0.4400981942347502,281.0,103.0,True,4,5,0.006194725968033321,0.9172430418713936,3,SGD,0.0005538086720756396,COMPLETE
41,0.9833073914051056,2024-04-22 09:37:32.933377,2024-04-22 09:37:48.160585,0 days 00:00:15.227208,0.44604100625579923,302.0,111.0,True,4,5,0.006347378573850758,0.9416887474936837,3,SGD,0.00051742753725122,COMPLETE
42,1.4059366583824158,2024-04-22 09:37:48.160891,2024-04-22 09:38:03.465227,0 days 00:00:15.304336,0.4553054565174763,287.0,102.0,True,4,5,0.005617408542643642,0.918314515187744,3,SGD,0.0020923528666048096,COMPLETE
43,1.0412302613258362,2024-04-22 09:38:03.465517,2024-04-22 09:38:18.642910,0 days 00:00:15.177393,0.4356975394581983,313.0,130.0,True,4,5,0.0031536270135875417,0.9419306225153841,3,SGD,0.000476285940858435,COMPLETE
44,1.2784559726715088,2024-04-22 09:38:18.643185,2024-04-22 09:38:33.854706,0 days 00:00:15.211521,0.4859738909913608,173.0,111.0,True,4,5,0.006625427930392899,0.8979415250698194,3,SGD,0.0013245542489099145,COMPLETE
45,2.157291889190674,2024-04-22 09:38:33.854974,2024-04-22 09:38:49.035745,0 days 00:00:15.180771,0.46665045277197115,234.0,128.0,False,4,4,0.0018657000412965695,0.9215966814892049,3,SGD,0.0006871085206518426,COMPLETE
46,1.4701725840568542,2024-04-22 09:38:49.036015,2024-04-22 09:39:04.292842,0 days 00:00:15.256827,0.4057900193112107,429.0,163.0,True,4,5,0.00954715749166382,0.9427639044836307,3,SGD,0.0030597716701489443,COMPLETE
47,1.393761157989502,2024-04-22 09:39:04.293121,2024-04-22 09:39:19.575573,0 days 00:00:15.282452,0.4400251196564088,606.0,,False,4,5,0.004035940486056007,0.8829038262805838,2,SGD,0.00029366554795836887,COMPLETE
48,1.011469691991806,2024-04-22 09:39:19.575842,2024-04-22 09:39:34.746149,0 days 00:00:15.170307,0.36477495132314536,362.0,146.0,True,4,4,0.0014201656023138754,0.9693611032690523,3,SGD,0.0004720277090216979,COMPLETE
49,1.3205029964447021,2024-04-22 09:39:34.746419,2024-04-22 09:39:49.696949,0 days 00:00:14.950530,0.3924311553555526,237.0,115.0,True,3,5,0.002946794621370499,0.8069046645893595,3,SGD,0.0008000476912025234,COMPLETE
50,1.4530841708183289,2024-04-22 09:39:49.697260,2024-04-22 09:40:04.970760,0 days 00:00:15.273500,0.42383789153078744,480.0,,True,4,5,0.00541713078889331,0.9922611223047696,2,SGD,6.19334454503408e-05,COMPLETE
51,1.1253982782363892,2024-04-22 09:40:04.971038,2024-04-22 09:40:20.139798,0 days 00:00:15.168760,0.3542623071350909,367.0,147.0,True,4,4,0.0014900555570688896,0.9700472937700877,3,SGD,0.0005033059117930483,COMPLETE
52,0.8520714342594147,2024-04-22 09:40:20.140072,2024-04-22 09:40:35.425240,0 days 00:00:15.285168,0.3793534436638776,572.0,205.0,True,4,4,0.002487875346935099,0.9555613407981288,3,SGD,0.0003431640591527621,COMPLETE
53,1.179214745759964,2024-04-22 09:40:35.425525,2024-04-22 09:40:50.716690,0 days 00:00:15.291165,0.4690752286385773,573.0,201.0,True,4,4,0.007003668977795596,0.9549484327760263,3,SGD,0.0003141549834657968,COMPLETE
54,1.026046335697174,2024-04-22 09:40:50.716976,2024-04-22 09:41:05.943598,0 days 00:00:15.226622,0.32186547533089643,410.0,205.0,True,4,4,0.002344302059047195,0.9337197599692341,3,SGD,0.0015517338957993722,COMPLETE
55,1.3335396647453308,2024-04-22 09:41:05.943902,2024-04-22 09:41:21.367474,0 days 00:00:15.423572,0.3894834772584342,706.0,344.0,True,4,4,0.00399509226786963,0.9432371564996048,3,SGD,0.00014170419035030007,COMPLETE
56,2.3014204502105713,2024-04-22 09:41:21.367758,2024-04-22 09:41:36.682582,0 days 00:00:15.314824,0.4209654467689983,639.0,483.0,False,4,4,0.000776815228464185,0.8603538521538522,3,SGD,0.0002178778896052228,COMPLETE
57,1.1248910427093506,2024-04-22 09:41:36.682860,2024-04-22 09:41:51.996552,0 days 00:00:15.313692,0.37813088720270027,569.0,218.0,True,4,5,0.0025552019505691763,0.9306818012605418,3,SGD,0.0009236304326585516,COMPLETE
58,2.0070825815200806,2024-04-22 09:41:51.996846,2024-04-22 09:42:07.329423,0 days 00:00:15.332577,0.33510894418983367,810.0,,True,4,4,1.8360772664851077e-05,0.9580267296405437,2,SGD,0.0005825668882990581,COMPLETE
59,1.1740113496780396,2024-04-22 09:42:07.329706,2024-04-22 09:42:22.764732,0 days 00:00:15.435026,0.2833035302413249,698.0,375.0,True,4,5,0.004775990400067256,0.9132874013815918,3,SGD,1.738506258272992e-05,COMPLETE
60,1.1017586588859558,2024-04-22 09:42:22.765033,2024-04-22 09:42:38.011378,0 days 00:00:15.246345,0.3979058366499401,333.0,266.0,True,4,5,0.003685341215918389,0.9514222883983805,3,SGD,0.00036194741577440535,COMPLETE
61,1.0889334082603455,2024-04-22 09:42:38.011659,2024-04-22 09:42:53.240150,0 days 00:00:15.228491,0.3657758782218575,267.0,126.0,True,4,4,0.0014660606905122012,0.9680291191160882,3,SGD,0.0002814328388566914,COMPLETE
62,1.099543273448944,2024-04-22 09:42:53.240430,2024-04-22 09:43:08.502933,0 days 00:00:15.262503,0.3108590247797936,385.0,139.0,True,4,4,0.0012714222728764694,0.9901362822987683,3,SGD,0.0005321774624387864,COMPLETE
63,1.1827347874641418,2024-04-22 09:43:08.503215,2024-04-22 09:43:23.769520,0 days 00:00:15.266305,0.36189169313657077,506.0,166.0,True,4,4,0.0019697140720430504,0.9712709920019986,3,SGD,0.00018396990014042154,COMPLETE
64,2.292293906211853,2024-04-22 09:43:23.769822,2024-04-22 09:43:38.997074,0 days 00:00:15.227252,0.34252305709701386,167.0,119.0,True,4,4,0.008879014530414474,0.9989484546006399,3,SGD,0.00011548392735425295,COMPLETE
65,1.1481680274009705,2024-04-22 09:43:38.997393,2024-04-22 09:43:54.193680,0 days 00:00:15.196287,0.4958061839992352,328.0,192.0,True,4,4,0.0032885595388467766,0.9632398217204023,3,SGD,0.0004209718107384733,COMPLETE
66,1.1537883281707764,2024-04-22 09:43:54.193986,2024-04-22 09:44:09.506647,0 days 00:00:15.312661,0.43508639609053795,605.0,153.0,True,4,4,0.0005458352792987304,0.9837324093799046,3,SGD,0.0006467809830997378,COMPLETE
67,1.1069884300231934,2024-04-22 09:44:09.506957,2024-04-22 09:44:24.631869,0 days 00:00:15.124912,0.32560458233721307,411.0,,True,4,3,0.0009813038714214278,0.9049904947174459,2,SGD,0.00025015238751039217,COMPLETE
68,2.2982271909713745,2024-04-22 09:44:24.632136,2024-04-22 09:44:39.910385,0 days 00:00:15.278249,0.29177938678822196,534.0,293.0,False,4,4,0.0014535394368182417,0.9390946875243681,3,SGD,0.00038225599828469386,COMPLETE
69,1.0957438051700592,2024-04-22 09:44:39.910679,2024-04-22 09:44:54.991774,0 days 00:00:15.081095,0.26366490233298906,103.0,,True,4,3,0.007509489556747831,0.8348225899486144,2,SGD,0.0008220649917863638,COMPLETE
70,0.8163441121578217,2024-04-22 09:44:54.992071,2024-04-22 09:45:10.266331,0 days 00:00:15.274260,0.38036790628730194,488.0,244.0,True,4,5,0.0008765330991718377,0.9785131152938741,3,SGD,1.006415714918741e-05,COMPLETE
71,1.1480454802513123,2024-04-22 09:45:10.266616,2024-04-22 09:45:25.600252,0 days 00:00:15.333636,0.38077057344153314,488.0,237.0,True,4,5,0.0008899963236755766,0.9763923719783208,3,SGD,2.7012825415872982e-05,COMPLETE
72,1.2023587226867676,2024-04-22 09:45:25.600551,2024-04-22 09:45:40.847994,0 days 00:00:15.247443,0.45488916094045917,428.0,241.0,True,4,5,0.0006597546161922435,0.9623276194344937,3,SGD,1.517024348608719e-05,COMPLETE
73,1.0392108261585236,2024-04-22 09:45:40.848280,2024-04-22 09:45:56.163147,0 days 00:00:15.314867,0.40877993210823826,557.0,318.0,True,4,5,0.0012656613856259146,0.9493416559577871,3,SGD,1.0765752155872282e-05,COMPLETE
74,1.0217782258987427,2024-04-22 09:45:56.163430,2024-04-22 09:46:11.468483,0 days 00:00:15.305053,0.3671940724353889,451.0,226.0,True,4,5,0.002035039583490189,0.9876854561854308,3,SGD,3.33547571860908e-05,COMPLETE
75,1.6946049928665161,2024-04-22 09:46:11.468779,2024-04-22 09:46:26.694936,0 days 00:00:15.226157,0.23597002299635222,272.0,184.0,True,4,5,0.0027128993884023636,,3,Adam,9.349377453669526e-05,COMPLETE
76,1.264657199382782,2024-04-22 09:46:26.695223,2024-04-22 09:46:41.961620,0 days 00:00:15.266397,0.3451753734887345,391.0,263.0,True,4,5,0.0004243376981877822,0.9791812379849675,3,SGD,4.7647240986141205e-05,COMPLETE
77,1.10182523727417,2024-04-22 09:46:41.961898,2024-04-22 09:46:57.262369,0 days 00:00:15.300471,0.30768463001601415,206.0,100.0,True,4,5,0.005324247753041152,0.9741270576359526,3,SGD,0.0010606035313743484,COMPLETE
78,0.8236140012741089,2024-04-22 09:46:57.262654,2024-04-22 09:47:12.665570,0 days 00:00:15.402916,0.424505883935407,672.0,439.0,True,4,4,0.0016818040341630542,0.959812804641035,3,SGD,0.0001792471120654568,COMPLETE
79,1.0289440751075745,2024-04-22 09:47:12.665855,2024-04-22 09:47:28.048254,0 days 00:00:15.382399,0.46920987997695673,659.0,426.0,True,4,5,0.0017867123809519637,0.9279030923951124,3,SGD,2.2022500910158516e-05,COMPLETE
80,1.0532463788986206,2024-04-22 09:47:28.048548,2024-04-22 09:47:43.161392,0 days 00:00:15.112844,0.4332103409038385,595.0,479.0,True,3,3,0.00029547001195266514,,3,Adam,0.00020354033872904234,COMPLETE
81,0.9619295001029968,2024-04-22 09:47:43.161705,2024-04-22 09:47:58.530688,0 days 00:00:15.368983,0.39336396317129096,734.0,446.0,True,4,4,0.0013071366041856357,0.9571649311775301,3,SGD,0.0001383485144580678,COMPLETE
82,0.9701708257198334,2024-04-22 09:47:58.530969,2024-04-22 09:48:13.892380,0 days 00:00:15.361411,0.39084722977796726,733.0,394.0,True,4,4,0.0016722488870727114,0.9579767238945389,3,SGD,0.00015164457764544579,COMPLETE
83,1.025256633758545,2024-04-22 09:48:13.892675,2024-04-22 09:48:29.313953,0 days 00:00:15.421278,0.3890934319035711,780.0,513.0,True,4,4,0.0011492036807903615,0.9585146584612122,3,SGD,0.0001441604139883081,COMPLETE
84,1.0167513489723206,2024-04-22 09:48:29.314237,2024-04-22 09:48:44.696907,0 days 00:00:15.382670,0.42225155433059264,724.0,401.0,True,4,4,0.0024217715792961866,0.9446774983037834,3,SGD,0.00011989040551727513,COMPLETE
85,0.8705567419528961,2024-04-22 09:48:44.697194,2024-04-22 09:49:00.156928,0 days 00:00:15.459734,0.40165797047944324,802.0,547.0,True,4,4,0.0009007264603303476,0.9640936074680418,3,SGD,7.313978515130718e-05,COMPLETE
86,2.2134822607040405,2024-04-22 09:49:00.157225,2024-04-22 09:49:15.568585,0 days 00:00:15.411360,0.4000474699404579,856.0,607.0,False,4,4,0.0008827010374741986,0.9644035764359833,3,SGD,7.947092027242083e-05,COMPLETE
87,1.0021900832653046,2024-04-22 09:49:15.568903,2024-04-22 09:49:30.677119,0 days 00:00:15.108216,0.40977769921871005,,,True,4,4,0.0006550863891974429,0.9831003865960375,1,SGD,5.9434280599216335e-05,COMPLETE
88,1.144162356853485,2024-04-22 09:49:30.677375,2024-04-22 09:49:46.069425,0 days 00:00:15.392050,0.3200431325016161,810.0,604.0,True,4,4,0.0016815320862221333,0.9546011094063046,3,SGD,0.00016031921489932383,COMPLETE
89,1.3019149899482727,2024-04-22 09:49:46.069712,2024-04-22 09:50:01.495016,0 days 00:00:15.425304,0.38181641560819785,930.0,562.0,True,4,4,0.0009733381266224391,0.8727466378991622,3,SGD,9.769669279778211e-05,COMPLETE
90,1.1302580833435059,2024-04-22 09:50:01.495335,2024-04-22 09:50:16.823024,0 days 00:00:15.327689,0.3466937106865527,672.0,440.0,True,4,4,0.0013375690993795888,0.9653376042469627,3,SGD,0.00023006346036927278,COMPLETE
91,0.9297304749488831,2024-04-22 09:50:16.823308,2024-04-22 09:50:32.179583,0 days 00:00:15.356275,0.4207686664048532,731.0,375.0,True,4,4,0.0016124410442387611,0.9476961279967868,3,SGD,0.0001776932369891003,COMPLETE
92,1.1709298491477966,2024-04-22 09:50:32.179871,2024-04-22 09:50:47.582772,0 days 00:00:15.402901,0.0033848030765269432,741.0,368.0,True,4,4,0.0020708201160041704,0.9497921013646689,3,SGD,0.00017372615382960161,COMPLETE
93,1.0654127597808838,2024-04-22 09:50:47.583088,2024-04-22 09:51:02.898075,0 days 00:00:15.314987,0.39071408141934016,622.0,409.0,True,4,4,0.0011379599350109708,0.9588561525663442,3,SGD,0.00026274792750967846,COMPLETE
94,0.9848452806472778,2024-04-22 09:51:02.898371,2024-04-22 09:51:18.321663,0 days 00:00:15.423292,0.4177175209643944,761.0,506.0,True,4,4,0.0017621007731882772,0.9745763342154743,3,SGD,0.00012795709562552128,COMPLETE
95,1.029160976409912,2024-04-22 09:51:18.321951,2024-04-22 09:51:33.759461,0 days 00:00:15.437510,0.35733560275944776,819.0,689.0,True,4,4,0.0015557576173407155,0.9475339550270716,3,SGD,0.0003357768232189616,COMPLETE
96,0.9863850176334381,2024-04-22 09:51:33.759758,2024-04-22 09:51:49.118190,0 days 00:00:15.358432,0.373726778824289,720.0,454.0,True,4,4,0.0031526841847619846,0.9585992983403051,3,SGD,6.845430971499905e-05,COMPLETE
97,1.5140362977981567,2024-04-22 09:51:49.118477,2024-04-22 09:52:04.525479,0 days 00:00:15.407002,0.42361976011756663,658.0,353.0,True,4,4,0.0007469832065716336,,3,Adam,0.00010875552124225647,COMPLETE
98,0.9548111259937286,2024-04-22 09:52:04.525763,2024-04-22 09:52:19.791448,0 days 00:00:15.265685,0.33351718556690435,536.0,426.0,True,4,4,0.0020940433459126313,0.9376650570869928,3,SGD,0.00020184573231654278,COMPLETE
99,1.8630602955818176,2024-04-22 09:52:19.791765,2024-04-22 09:52:35.099917,0 days 00:00:15.308152,0.021005451049560975,519.0,417.0,False,4,4,0.0024794537551837493,0.9397051409425426,3,SGD,0.00019387510315223665,COMPLETE
100,1.189352810382843,2024-04-22 09:52:35.100204,2024-04-22 09:52:50.375068,0 days 00:00:15.274864,0.3358985889716607,575.0,,True,4,4,0.0021863040304531747,0.8534817507555408,2,SGD,0.0002124577980343484,COMPLETE
